{
  "spec": 1,
  "id": "autonomous/starter",
  "name": "Starter",
  "description": "The smallest domain-specific harness: a manifest, an AGENTS.md, and one skill.",
  "engine": "claude",
  "workspace": {
    "template": "template",
    "marker": "NOTES.md"
  },
  "agent": {
    "instructions": "AGENTS.md",
    "skills": ["skills"],
    "env": { "STARTER_DSH_DIR": "${dsh}" }
  },
  "toolchain": {
    "setup": "toolchain/setup.sh",
    "doctor": "toolchain/doctor.sh"
  }
}
